ID,Document ID,Document Title,Annex,Section L1,Section L2,Section L3,Section L4,Essential Requirement
75,2006/42/EC,Machinery Directive,I,1,1,5,,"1.1.5. Design of machinery to facilitate its handling Machinery, or each component part thereof, must: — be capable of being handled and transported safely, — be packaged or designed so that it can be stored safely and without damage. During the transportation of the machinery and/or its component parts, there must be no possibility of sudden movements or of hazards due to instability as long as the machinery and/or its component parts are handled in accordance with the instructions. Where the weight, size or shape of machinery or its various component parts prevents them from being moved by hand, the machinery or each component part must: — either be fitted with attachments for lifting gear, or — be designed so that it can be fitted with such attachments, or — be shaped in such a way that standard lifting gear can easily be attached. Where machinery or one of its component parts is to be moved by hand, it must: — either be easily moveable, or — be equipped for picking up and moving safely. Special arrangements must be made for the handling of tools and/or machinery parts which, even if lightweight, could be hazardous."
76,2006/42/EC,Machinery Directive,I,1,1,6,,"1.1.6. Ergonomics Under the intended conditions of use, the discomfort, fatigue and physical and psychological stress faced by the operator must be reduced to the minimum possible, taking into account ergonomic principles such as: — allowing for the variability of the operator's physical dimensions, strength and stamina, — providing enough space for movements of the parts of the operator's body, — avoiding a machine-determined work rate, — avoiding monitoring that requires lengthy concentration, — adapting the man/machinery interface to the foreseeable characteristics of the operators."
77,2006/42/EC,Machinery Directive,I,1,1,7,,"1.1.7. Operating positions The operating position must be designed and constructed in such a way as to avoid any risk due to exhaust gases and/or lack of oxygen. If the machinery is intended to be used in a hazardous environment presenting risks to the health and safety of the operator or if the machinery itself gives rise to a hazardous environment, adequate means must be provided to ensure that the operator has good working conditions and is protected against any foreseeable hazards. Where appropriate, the operating position must be fitted with an adequate cabin designed, constructed and/or equipped to fulfil the above requirements. The exit must allow rapid evacuation. Moreover, when applicable, an emergency exit must be provided in a direction which is different from the usual exit."
78,2006/42/EC,Machinery Directive,I,1,1,8,,"1.1.8. Seating Where appropriate and where the working conditions so permit, work stations constituting an integral part of the machinery must be designed for the installation of seats. If the operator is intended to sit during operation and the operating position is an integral part of the machinery, the seat must be provided with the machinery. The operator's seat must enable him to maintain a stable position. Furthermore, the seat and its distance from the control devices must be capable of being adapted to the operator. If the machinery is subject to vibrations, the seat must be designed and constructed in such a way as to reduce the vibrations transmitted to the operator to the lowest level that is reasonably possible. The seat mountings must withstand all stresses to which they can be subjected. Where there is no floor beneath the feet of the operator, footrests covered with a slip-resistant material must be provided."
79,2006/42/EC,Machinery Directive,I,1,2,,,1.2. CONTROL SYSTEMS
80,2006/42/EC,Machinery Directive,I,1,2,1,,"1.2.1. Safety and reliability of control systems Control systems must be designed and constructed in such a way as to prevent hazardous situations from arising. Above all, they must be designed and constructed in such a way that: — they can withstand the intended operating stresses and external influences, — a fault in the hardware or the software of the control system does not lead to hazardous situations, — errors in the control system logic do not lead to hazardous situations, — reasonably foreseeable human error during operation does not lead to hazardous situations. Particular attention must be given to the following points: — the machinery must not start unexpectedly, — the parameters of the machinery must not change in an uncontrolled way, where such change may lead to hazardous situations, — the machinery must not be prevented from stopping if the stop command has already been given, — no moving part of the machinery or piece held by the machinery must fall or be ejected, — automatic or manual stopping of the moving parts, whatever they may be, must be unimpeded, — the protective devices must remain fully effective or give a stop command, — the safety-related parts of the control system must apply in a coherent way to the whole of an assembly of machinery and/or partly completed machinery. For cable-less control, an automatic stop must be activated when correct control signals are not received, including loss of communication."
81,2006/42/EC,Machinery Directive,I,1,2,2,,"1.2.2. Control devices Control devices must be: — clearly visible and identifiable, using pictograms where appropriate, — positioned in such a way as to be safely operated without hesitation or loss of time and without ambiguity, — designed in such a way that the movement of the control device is consistent with its effect, — located outside the danger zones, except where necessary for certain control devices such as an emergency stop or a teach pendant, — positioned in such a way that their operation cannot cause additional risk, — designed or protected in such a way that the desired effect, where a hazard is involved, can only be achieved by a deliberate action, — made in such a way as to withstand foreseeable forces; particular attention must be paid to emergency stop devices liable to be subjected to considerable forces. Where a control device is designed and constructed to perform several different actions, namely where there is no one-to-one correspondence, the action to be performed must be clearly displayed and subject to confirmation, where necessary. Control devices must be so arranged that their layout, travel and resistance to operation are compatible with the action to be performed, taking account of ergonomic principles. Machinery must be fitted with indicators as required for safe operation. The operator must be able to read them from the control position. From each control position, the operator must be able to ensure that no-one is in the danger zones, or the control system must be designed and constructed in such a way that starting is prevented while someone is in the danger zone. If neither of these possibilities is applicable, before the machinery starts, an acoustic and/or visual warning signal must be given. The exposed persons must have time to leave the danger zone or prevent the machinery starting up. If necessary, means must be provided to ensure that the machinery can be controlled only from control positions located in one or more predetermined zones or locations. Where there is more than one control position, the control system must be designed in such a way that the use of one of them precludes the use of the others, except for stop controls and emergency stops. When machinery has two or more operating positions, each position must be provided with all the required control devices without the operators hindering or putting each other into a hazardous situation."
82,2006/42/EC,Machinery Directive,I,1,2,3,,"1.2.3. Starting It must be possible to start machinery only by voluntary actuation of a control device provided for the purpose. The same requirement applies: — when restarting the machinery after a stoppage, whatever the cause, — when effecting a significant change in the operating conditions. However, the restarting of the machinery or a change in operating conditions may be effected by voluntary actuation of a device other than the control device provided for the purpose, on condition that this does not lead to a hazardous situation. For machinery functioning in automatic mode, the starting of the machinery, restarting after a stoppage, or a change in operating conditions may be possible without intervention, provided this does not lead to a hazardous situation. Where machinery has several starting control devices and the operators can therefore put each other in danger, additional devices must be fitted to rule out such risks. If safety requires that starting and/or stopping must be performed in a specific sequence, there must be devices which ensure that these operations are performed in the correct order."
83,2006/42/EC,Machinery Directive,I,1,2,4,,1.2.4. Stopping
84,2006/42/EC,Machinery Directive,I,1,2,4,1,"1.2.4.1. Normal stop Machinery must be fitted with a control device whereby the machinery can be brought safely to a complete stop. Each workstation must be fitted with a control device to stop some or all of the functions of the machinery, depending on the existing hazards, so that the machinery is rendered safe. The machinery's stop control must have priority over the start controls. Once the machinery or its hazardous functions have stopped, the energy supply to the actuators concerned must be cut off."
85,2006/42/EC,Machinery Directive,I,1,2,4,2,"1.2.4.2. Operational stop Where, for operational reasons, a stop control that does not cut off the energy supply to the actuators is required, the stop condition must be monitored and maintained."
86,2006/42/EC,Machinery Directive,I,1,2,4,3,"1.2.4.3. Emergency stop Machinery must be fitted with one or more emergency stop devices to enable actual or impending danger to be averted. The following exceptions apply: — machinery in which an emergency stop device would not lessen the risk, either because it would not reduce the stopping time or because it would not enable the special measures required to deal with the risk to be taken, — portable hand-held and/or hand-guided machinery. The device must: — have clearly identifiable, clearly visible and quickly accessible control devices, — stop the hazardous process as quickly as possible, without creating additional risks, — where necessary, trigger or permit the triggering of certain safeguard movements. Once active operation of the emergency stop device has ceased following a stop command, that command must be sustained by engagement of the emergency stop device until that engagement is specifically overridden; it must not be possible to engage the device without triggering a stop command; it must be possible to disengage the device only by an appropriate operation, and disengaging the device must not restart the machinery but only permit restarting. The emergency stop function must be available and operational at all times, regardless of the operating mode. Emergency stop devices must be a back-up to other safeguarding measures and not a substitute for them."
87,2006/42/EC,Machinery Directive,I,1,2,4,4,"1.2.4.4. Assembly of machinery In the case of machinery or parts of machinery designed to work together, the machinery must be designed and constructed in such a way that the stop controls, including the emergency stop devices, can stop not only the machinery itself but also all related equipment, if its continued operation may be dangerous."
88,2006/42/EC,Machinery Directive,I,1,2,5,,"1.2.5. Selection of control or operating modes The control or operating mode selected must override all other control or operating modes, with the exception of the emergency stop. If machinery has been designed and constructed to allow its use in several control or operating modes requiring different protective measures and/or work procedures, it must be fitted with a mode selector which can be locked in each position. Each position of the selector must be clearly identifiable and must correspond to a single operating or control mode. The selector may be replaced by another selection method which restricts the use of certain functions of the machinery to certain categories of operator. If, for certain operations, the machinery must be able to operate with a guard displaced or removed and/or a protective device disabled, the control or operating mode selector must simultaneously: — disable all other control or operating modes, — permit operation of hazardous functions only by control devices requiring sustained action, — permit the operation of hazardous functions only in reduced risk conditions while preventing hazards from linked sequences, — prevent any operation of hazardous functions by voluntary or involuntary action on the machine's sensors. If these four conditions cannot be fulfilled simultaneously, the control or operating mode selector must activate other protective measures designed and constructed to ensure a safe intervention zone. In addition, the operator must be able to control operation of the parts he is working on from the adjustment point."
89,2006/42/EC,Machinery Directive,I,1,2,6,,"1.2.6. Failure of the power supply The interruption, the re-establishment after an interruption or the fluctuation in whatever manner of the power supply to the machinery must not lead to dangerous situations. Particular attention must be given to the following points: — the machinery must not start unexpectedly, — the parameters of the machinery must not change in an uncontrolled way when such change can lead to hazardous situations, — the machinery must not be prevented from stopping if the command has already been given, — no moving part of the machinery or piece held by the machinery must fall or be ejected, — automatic or manual stopping of the moving parts, whatever they may be, must be unimpeded, — the protective devices must remain fully effective or give a stop command."
90,2006/42/EC,Machinery Directive,I,1,3,,,1.3. PROTECTION AGAINST MECHANICAL HAZARDS
91,2006/42/EC,Machinery Directive,I,1,3,1,,"1.3.1. Risk of loss of stability Machinery and its components and fittings must be stable enough to avoid overturning, falling or uncontrolled movements during transportation, assembly, dismantling and any other action involving the machinery. If the shape of the machinery itself or its intended installation does not offer sufficient stability, appropriate means of anchorage must be incorporated and indicated in the instructions."
92,2006/42/EC,Machinery Directive,I,1,3,2,,"1.3.2. Risk of break-up during operation The various parts of machinery and their linkages must be able to withstand the stresses to which they are subject when used. The durability of the materials used must be adequate for the nature of the working environment foreseen by the manufacturer or his authorised representative, in particular as regards the phenomena of fatigue, ageing, corrosion and abrasion. The instructions must indicate the type and frequency of inspections and maintenance required for safety reasons. They must, where appropriate, indicate the parts subject to wear and the criteria for replacement. Where a risk of rupture or disintegration remains despite the measures taken, the parts concerned must be mounted, positioned and/or guarded in such a way that any fragments will be contained, preventing hazardous situations. Both rigid and flexible pipes carrying fluids, particularly those under high pressure, must be able to withstand the foreseen internal and external stresses and must be firmly attached and/or protected to ensure that no risk is posed by a rupture. Where the material to be processed is fed to the tool automatically, the following conditions must be fulfilled to avoid risks to persons: — when the workpiece comes into contact with the tool, the latter must have attained its normal working condition, — when the tool starts and/or stops (intentionally or accidentally), the feed movement and the tool movement must be coordinated."
93,2006/42/EC,Machinery Directive,I,1,3,3,,1.3.3. Risks due to falling or ejected objects Precautions must be taken to prevent risks from falling or ejected objects.
94,2006/42/EC,Machinery Directive,I,1,3,4,,"1.3.4. Risks due to surfaces, edges or angles Insofar as their purpose allows, accessible parts of the machinery must have no sharp edges, no sharp angles and no rough surfaces likely to cause injury."
95,2006/42/EC,Machinery Directive,I,1,3,5,,"1.3.5. Risks related to combined machinery Where the machinery is intended to carry out several different operations with manual removal of the piece between each operation (combined machinery), it must be designed and constructed in such a way as to enable each element to be used separately without the other elements constituting a risk for exposed persons. For this purpose, it must be possible to start and stop separately any elements that are not protected."
96,2006/42/EC,Machinery Directive,I,1,3,6,,"1.3.6. Risks related to variations in operating conditions Where the machinery performs operations under different conditions of use, it must be designed and constructed in such a way that selection and adjustment of these conditions can be carried out safely and reliably."
97,2006/42/EC,Machinery Directive,I,1,3,7,,"1.3.7. Risks related to moving parts The moving parts of machinery must be designed and constructed in such a way as to prevent risks of contact which could lead to accidents or must, where risks persist, be fitted with guards or protective devices. All necessary steps must be taken to prevent accidental blockage of moving parts involved in the work. In cases where, despite the precautions taken, a blockage is likely to occur, the necessary specific protective devices and tools must, when appropriate, be provided to enable the equipment to be safely unblocked. The instructions and, where possible, a sign on the machinery shall identify these specific protective devices and how they are to be used."
98,2006/42/EC,Machinery Directive,I,1,3,8,,1.3.8. Choice of protection against risks arising from moving parts Guards or protective devices designed to protect against risks arising from moving parts must be selected on the basis of the type of risk. The following guidelines must be used to help to make the choice.
99,2006/42/EC,Machinery Directive,I,1,3,8,1,"1.3.8.1. Moving transmission parts Guards designed to protect persons against the hazards generated by moving transmission parts must be: — either fixed guards as referred to in section 1.4.2.1, or — interlocking movable guards as referred to in section 1.4.2.2. Interlocking movable guards should be used where frequent access is envisaged."
100,2006/42/EC,Machinery Directive,I,1,3,8,2,"1.3.8.2. Moving parts involved in the process Guards or protective devices designed to protect persons against the hazards generated by moving parts involved in the process must be: — either fixed guards as referred to in section 1.4.2.1, or — interlocking movable guards as referred to in section 1.4.2.2, or — protective devices as referred to in section 1.4.3, or — a combination of the above. However, when certain moving parts directly involved in the process cannot be made completely inaccessible during operation owing to operations requiring operator intervention, such parts must be fitted with: — fixed guards or interlocking movable guards preventing access to those sections of the parts that are not used in the work, and — adjustable guards as referred to in section 1.4.2.3 restricting access to those sections of the moving parts where access is necessary."
101,2006/42/EC,Machinery Directive,I,1,3,9,,"1.3.9. Risks of uncontrolled movements When a part of the machinery has been stopped, any drift away from the stopping position, for whatever reason other than action on the control devices, must be prevented or must be such that it does not present a hazard."
102,2006/42/EC,Machinery Directive,I,1,4,,,1.4. REQUIRED CHARACTERISTICS OF GUARDS AND PROTECTIVE DEVICES
103,2006/42/EC,Machinery Directive,I,1,4,1,,"1.4.1. General requirements Guards and protective devices must: — be of robust construction, — be securely held in place, — not give rise to any additional hazard, — not be easy to by-pass or render non-operational, — be located at an adequate distance from the danger zone, — cause minimum obstruction to the view of the production process, and — enable essential work to be carried out on the installation and/or replacement of tools and for maintenance purposes by restricting access exclusively to the area where the work has to be done, if possible without the guard having to be removed or the protective device having to be disabled. In addition, guards must, where possible, protect against the ejection or falling of materials or objects and against emissions generated by the machinery."
104,2006/42/EC,Machinery Directive,I,1,4,2,,1.4.2. Special requirements for guards
105,2006/42/EC,Machinery Directive,I,1,4,2,1,"1.4.2.1. Fixed guards Fixed guards must be fixed by systems that can be opened or removed only with tools. Their fixing systems must remain attached to the guards or to the machinery when the guards are removed. Where possible, guards must be incapable of remaining in place without their fixings."
106,2006/42/EC,Machinery Directive,I,1,4,2,2,"1.4.2.2. Interlocking movable guards Interlocking movable guards must: — as far as possible remain attached to the machinery when open, — be designed and constructed in such a way that they can be adjusted only by means of an intentional action. Interlocking movable guards must be associated with an interlocking device that: — prevents the start of hazardous machinery functions until they are closed and — gives a stop command whenever they are no longer closed. Where it is possible for an operator to reach the danger zone before the risk due to the hazardous machinery functions has ceased, movable guards must be associated with a guard locking device in addition to an interlocking device that: — prevents the start of hazardous machinery functions until the guard is closed and locked, and — keeps the guard closed and locked until the risk of injury from the hazardous machinery functions has ceased. Interlocking movable guards must be designed in such a way that the absence or failure of one of their components prevents starting or stops the hazardous machinery functions."
107,2006/42/EC,Machinery Directive,I,1,4,2,3,"1.4.2.3. Adjustable guards restricting access Adjustable guards restricting access to those areas of the moving parts strictly necessary for the work must be: — adjustable manually or automatically, depending on the type of work involved, and — readily adjustable without the use of tools."
108,2006/42/EC,Machinery Directive,I,1,4,3,,"1.4.3. Special requirements for protective devices Protective devices must be designed and incorporated into the control system in such a way that: — moving parts cannot start up while they are within the operator's reach, — persons cannot reach moving parts while the parts are moving, and — the absence or failure of one of their components prevents starting or stops the moving parts. Protective devices must be adjustable only by means of an intentional action."
109,2006/42/EC,Machinery Directive,I,1,5,,,1.5. RISKS DUE TO OTHER HAZARDS
110,2006/42/EC,Machinery Directive,I,1,5,1,,"1.5.1. Electricity supply Where machinery has an electricity supply, it must be designed, constructed and equipped in such a way that all hazards of an electrical nature are or can be prevented. The safety objectives set out in Directive 73/23/EEC shall apply to machinery. However, the obligations concerning conformity assessment and the placing on the market and/or putting into service of machinery with regard to electrical hazards are governed solely by this Directive."
111,2006/42/EC,Machinery Directive,I,1,5,2,,1.5.2. Static electricity Machinery must be designed and constructed to prevent or limit the build-up of potentially dangerous electrostatic charges and/or be fitted with a discharging system.
112,2006/42/EC,Machinery Directive,I,1,5,3,,"1.5.3. Energy supply other than electricity Where machinery is powered by source of energy other than electricity, it must be so designed, constructed and equipped as to avoid all potential risks associated with such sources of energy."
113,2006/42/EC,Machinery Directive,I,1,5,4,,"1.5.4. Errors of fitting Errors likely to be made when fitting or refitting certain parts which could be a source of risk must be made impossible by the design and construction of such parts or, failing this, by information given on the parts themselves and/or their housings. The same information must be given on moving parts and/or their housings where the direction of movement needs to be known in order to avoid a risk. Where necessary, the instructions must give further information on these risks. Where a faulty connection can be the source of risk, incorrect connections must be made impossible by design or, failing this, by information given on the elements to be connected and, where appropriate, on the means of connection."
114,2006/42/EC,Machinery Directive,I,1,5,5,,1.5.5. Extreme temperatures Steps must be taken to eliminate any risk of injury arising from contact with or proximity to machinery parts or materials at high or very low temperatures. The necessary steps must also be taken to avoid or protect against the risk of hot or very cold material being ejected.
