ID,Document ID,Document Title,Annex,Section L1,Section L2,Section L3,Section L4,Essential Requirement
27,2023/1230,Machinery Regulation,III,1,2,4,6,"Failure of the power supply or communication network connection
The interruption, the re-establishment after an interruption or the fluctuation in whatever manner of the 
power supply or communication network connection to the machinery or related product shall not lead to 
hazardous situations.
Particular attention shall be given to the following:
(a) the machinery or related product shall not start unexpectedly;
(b) the parameters of the machinery shall not change in an uncontrolled way when such change can lead to 
hazardous situations;
(c) the machinery or related product shall not be prevented from stopping if the stop command has already 
been given;
(d) no moving part of the machinery or related product or piece held by the machinery or related product 
shall fall or be ejected;
(e) automatic or manual stopping of the moving parts, whatever they may be, shall be unimpeded;
(f) the protective devices shall remain fully effective or give a stop command."
28,2023/1230,Machinery Regulation,III,1,3,1,,"Risk of loss of stability
The machinery or related product and its components and fittings shall be stable enough to avoid overturning, falling or uncontrolled movements during transportation, assembly, dismantling and any other action 
involving the machinery or related product.
If the shape of the machinery or related product itself or its intended installation does not offer sufficient 
stability, appropriate means of anchorage shall be incorporated and indicated in the instructions for use."
29,2023/1230,Machinery Regulation,III,1,3,2,,"Risk of break-up during operation
The various parts of machinery or related products and their linkages shall be able to withstand the stresses 
to which they are subject when used.
The durability of the materials used shall be adequate for the nature of the working environment foreseen by 
the manufacturer, in particular as regards the phenomena of fatigue, ageing, corrosion and abrasion.
The instructions for use shall indicate the type and frequency of inspections and maintenance required for 
safety reasons. They shall, where appropriate, indicate the parts subject to wear and the criteria for 
replacement.
Where a risk of rupture or disintegration remains despite the measures taken, the parts concerned shall be 
mounted, positioned or guarded in such a way that any fragments will be contained, preventing hazardous 
situations.
Both rigid and flexible pipes carrying fluids, particularly those under high pressure, shall be able to withstand 
the foreseen internal and external stresses and shall be firmly attached or protected to ensure that no risk is 
presented by a rupture.
Where the material to be processed is fed to the tool automatically, the following conditions shall be fulfilled 
to avoid risks to persons:
(a) when the work piece comes into contact with the tool, the latter shall have attained its normal working 
condition;
(b) when the tool starts and/or stops (intentionally or accidentally), the feed movement and the tool 
movement shall be coordinated."
30,2023/1230,Machinery Regulation,III,1,3,3,,"Risks due to falling or ejected objects
Precautions shall be taken to prevent risks from falling or ejected objects"
31,2023/1230,Machinery Regulation,III,1,3,4,,"Risks due to surfaces, edges or angles
Insofar as their purpose allows, accessible parts of the machinery or a related product shall have no sharp 
edges, no sharp angles and no rough surfaces likely to cause injury"
32,2023/1230,Machinery Regulation,III,1,3,5,,"Risks related to a combined machinery or related product
Where the machinery or related product is intended to carry out several different operations with manual 
removal of the piece between each operation (combined machinery or related product), it shall be designed 
and constructed in such a way as to enable each element to be used separately without the other elements 
constituting a risk for exposed persons.
For this purpose, it shall be possible to start and stop separately any elements that are not protected."
33,2023/1230,Machinery Regulation,III,1,3,6,,"Risks related to variations in operating conditions
Where the machinery or related product performs operations under different conditions of use, it shall be 
designed and constructed in such a way that selection and adjustment of these conditions can be carried out 
safely and reliably."
34,2023/1230,Machinery Regulation,III,1,3,7,,"Risks related to moving parts
The moving parts of the machinery or related product shall be designed and constructed in such a way as to 
prevent risks of contact which could lead to accidents or shall, where risks persist, be fitted with guards or 
protective devices.
All necessary steps shall be taken to prevent accidental blockage of moving parts. In cases where, despite the 
precautions taken, a blockage is likely to occur, the necessary specific protective devices and tools shall, when 
appropriate, be provided to enable the equipment to be safely unblocked.
The instructions for use and, where possible, a sign on the machinery or related product shall identify these 
specific protective devices and how they are to be used.
The prevention of risks of contact leading to hazardous situations and the psychological stress that may be 
caused by the interaction with the machinery shall be adapted to:
(a) human-machine coexistence in a shared space without direct collaboration;
(b) human-machine interaction"
35,2023/1230,Machinery Regulation,III,1,3,8,,"Choice of protection against risks arising from moving parts
Guards or protective devices designed to protect against risks arising from moving parts shall be selected on 
the basis of the type of risk. The following guidelines shall be used to help to make the choice."
36,2023/1230,Machinery Regulation,III,1,3,8,1,"M o v i n g t r a n s m i s s i o n p a r t s
Guards designed to protect persons against the hazards generated by moving transmission parts shall be:
(a) either fixed guards as referred to in section 1.4.2.1; or
(b) interlocking movable guards as referred to in section 1.4.2.2.
Interlocking movable guards shall be used where frequent access is envisaged."
37,2023/1230,Machinery Regulation,III,1,3,8,2,"M o v i n g p a r t s i n v o l v e d i n t h e p r o c e s s
Guards or protective devices designed to protect persons against the hazards generated by moving parts 
involved in the process shall be:
(a) either fixed guards as referred to in section 1.4.2.1; or
(b) interlocking movable guards as referred to in section 1.4.2.2; or
(c) protective devices as referred to in section 1.4.3; or
(d) a combination of the above.
However, when certain moving parts directly involved in the process cannot be made completely inaccessible 
during operation owing to operations requiring operator intervention, such parts shall be fitted with:
(a) fixed guards or interlocking movable guards preventing access to those sections of the parts that are not 
used in the work; and
(b) adjustable guards as referred to in section 1.4.2.3 restricting access to those sections of the moving parts 
where access is necessary."
38,2023/1230,Machinery Regulation,III,1,3,9,,"Risks of uncontrolled movements
When a part of the machinery or related product has been stopped, any drift away from the stopping 
position, for whatever reason other than action on the control devices, shall be prevented or shall be 
such that it does not present a risk."
39,2023/1230,Machinery Regulation,iii,1,4,1,,"General requirements
Guards and protective devices shall:
(a) be of robust construction;
(b) be securely held in place;
(c) not give rise to any additional hazard;
(d) not be easy to by-pass or render non-operational;
(e) be located at an adequate distance from the danger zone;
(f) cause minimum obstruction to the view of the production process, and;
(g) enable essential work to be carried out on the installation and/or replacement of tools and for maintenance purposes by restricting access exclusively to the area where the work has to be done, if possible 
without the guard having to be removed or the protective device having to be disabled.
In addition, guards shall, where possible, protect against the ejection or falling of materials or objects and 
against emissions generated by the machinery or related product."
40,2023/1230,Machinery Regulation,III,1,4,2,1,"F i x e d g u a r d s
Fixed guards shall be fixed by systems that can be opened or removed only with tools.
Their fixing systems shall remain attached to the guards or to the machinery or related product when the 
guards are removed.
Where possible, guards shall be incapable of remaining in place without their fixings."
41,2023/1230,Machinery Regulation,III,1,4,2,2,"I n t e r l o c k i n g m o v a b l e g u a r d s
Interlocking movable guards shall:
(a) as far as possible remain attached to the machinery or related product when open;
(b) be designed and constructed in such a way that they can be adjusted only by means of an intentional 
action.
Interlocking movable guards shall be associated with an interlocking device that:
(a) prevents the start of hazardous machinery or related product functions until those guards are closed; and
(b) gives a stop command whenever those guards are no longer closed.
Where it is possible for an operator to reach the danger zone before the risk due to the hazardous machinery 
or related product functions has ceased, movable guards shall be associated with a guard locking device in 
addition to an interlocking device that:
(a) prevents the start of hazardous machinery or related product functions until the guard is closed and 
locked; and
(b) keeps the guard closed and locked until the risk of injury from the hazardous machinery or related 
product functions has ceased.
Interlocking movable guards shall be designed in such a way that the absence or failure of one of their 
components prevents starting or stops the hazardous machinery or related product functions."
42,2023/1230,Machinery Regulation,III,1,4,2,3,"Adjustable guards restricting access
Adjustable guards restricting access to those areas of the moving parts strictly necessary for the work shall be:
(a) adjustable manually or automatically, depending on the type of work involved; and
(b) readily adjustable without the use of tools."
43,2023/1230,Machinery Regulation,III,1,4,3,,"Special requirements for protective devices
Protective devices shall be designed and incorporated into the control system in such a way that:
(a) moving parts cannot start up while they are within the operator’s reach;
(b) persons cannot reach moving parts while the parts are moving, and
(c) the absence or failure of one of their components prevents starting or stops the moving parts.
Protective devices shall be adjustable only by means of an intentional action."
44,2023/1230,Machinery Regulation,III,1,5,1,,"Electricity supply
Where machinery or related products have an electricity supply, they shall be designed, constructed and 
equipped in such a way that all hazards of an electrical nature are or can be prevented.
The safety objectives set out in Directive 2014/35/EU shall apply to machinery or related products. However, 
the obligations concerning conformity assessment and the placing on the market or putting into service of 
machinery or related products with regard to electrical risks are governed solely by this Regulation."
47,2023/1230,Machinery Regulation,III,1,5,2,,"Static electricity
Machinery or related products shall be designed and constructed to prevent or limit the build-up of potentially dangerous electrostatic charges and/or be fitted with a discharging system"
48,2023/1230,Machinery Regulation,III,1,5,3,,"Energy supply other than electricity
Where machinery or related products are powered by source of energy other than electricity, they shall be so designed, constructed and equipped as to avoid all potential risks associated with such sources of energy."
49,2023/1230,Machinery Regulation,III,1,5,4,,"Errors of fitting
Errors likely to be made when fitting or refitting certain parts, which could be a source of risk, shall be made 
impossible by the design and construction of such parts or, failing this, by information given on the parts 
themselves or their housings. The same information shall be given on moving parts or their housings where 
the direction of movement needs to be known in order to avoid a risk.
Where necessary, the instructions for use shall give further information on these risks.
Where a faulty connection can be the source of risk, incorrect connections shall be made impossible by 
design or, failing this, by information given on the elements to be connected and, where appropriate, on the 
means of connection."
50,2023/1230,Machinery Regulation,III,1,5,5,,"Extreme temperatures
Steps shall be taken to eliminate any risk of injury arising from contact with or proximity to machinery or 
related product parts or materials at high or very low temperatures.
The necessary steps shall also be taken to avoid or protect against the risk of hot or very cold material being 
ejected"
51,2023/1230,Machinery Regulation,III,1,5,6,,"Fire
Machinery or related products shall be designed and constructed in such a way as to avoid any risk of fire or 
overheating presented by the machinery or related product itself or by gases, liquids, dust, vapours or other 
substances produced or used by the machinery or related product."
52,2023/1230,Machinery Regulation,III,1,5,7,,"Explosion
Machinery or related products shall be designed and constructed in such a way as to avoid any risk of 
explosion presented by the machinery or related product itself or by gases, liquids, dust, vapours or other 
substances produced or used by the machinery or related product.
Machinery or related products shall comply, as far as the risk of explosion due to its use in a potentially 
explosive atmosphere is concerned, with the provisions of the specific Union harmonisation legislation."
53,2023/1230,Machinery Regulation,III,1,5,8,,"Noise
Machinery or related products shall be designed and constructed in such a way that risks resulting from the 
emission of airborne noise are reduced to the lowest level, taking account of technical progress and the 
availability of means of reducing noise, in particular at source.
The level of noise emission may be assessed with reference to comparative emission data for similar 
machinery or related products."
54,2023/1230,Machinery Regulation,III,1,5,9,,"Vibrations
Machinery or related products shall be designed and constructed in such a way that risks resulting from 
vibrations produced by the machinery or related product are reduced to the lowest level, taking account of 
technical progress and the availability of means of reducing vibration, in particular at source.
The level of vibration emission may be assessed with reference to comparative emission data for similar 
machinery or related products."
55,2023/1230,Machinery Regulation,III,1,5,10,,"Radiation
Undesirable radiation emissions from machinery or related products shall be eliminated or be reduced to 
levels that do not have adverse effects on persons.
Any functional ionising radiation emissions shall be limited to the lowest level, which is sufficient for the 
proper functioning of the machinery or related product during setting, operation and cleaning. Where a risk 
exists, the necessary protective measures shall be taken.
Any functional non-ionising radiation emissions during setting, operation and cleaning shall be limited to 
levels that do not have adverse effects on persons."
56,2023/1230,Machinery Regulation,III,1,5,11,,"External radiation
Machinery or related products shall be designed and constructed in such a way that external radiation does 
not interfere with its operation."
57,2023/1230,Machinery Regulation,III,1,5,12,,"Laser radiation
Where laser equipment is used, the following shall be taken into account:
(a) laser equipment on machinery or related products shall be designed and constructed in such a way as to 
prevent any accidental radiation;
(b) laser equipment on machinery or related products shall be protected in such a way that effective radiation, radiation produced by reflection or diffusion and secondary radiation do not damage health;
(c) optical equipment for the observation or adjustment of laser equipment on machinery or related products 
shall be such that no health risk is created by laser radiation."
58,2023/1230,Machinery Regulation,III,1,5,13,,"Emissions of hazardous materials and substances
Machinery or related products shall be designed and constructed in such a way that risks of inhalation, 
ingestion, contact with the skin, eyes and mucous membranes and penetration through the skin of hazardous 
materials and substances which it produces can be avoided.
Where a hazard cannot be eliminated, the machinery or related product shall be so equipped that hazardous 
materials and substances can be contained, captured, evacuated, precipitated by water spraying, filtered or 
treated by another equally effective method.
Where the process is not totally enclosed during normal operation of the machinery or related product, the 
devices for containment or capture, filtration or separation and evacuation shall be situated in such a way as 
to have the maximum effect."
59,2023/1230,Machinery Regulation,III,1,5,14,,"Risk of being trapped in a machine
Machinery or related products shall be designed, constructed or fitted with a means of preventing a person 
from being enclosed within it or, if that is impossible, with a means of summoning help."
60,2023/1230,Machinery Regulation,III,1,5,15,,"Risk of slipping, tripping or falling
Parts of the machinery or related product where persons are liable to move about or stand shall be designed 
and constructed in such a way as to prevent persons slipping, tripping or falling on or off these parts.
Where appropriate, these parts shall be fitted with handholds that are fixed relative to the user and that 
enable them to maintain their stability."
61,2023/1230,Machinery Regulation,III,1,5,16,,"Lightning
Machinery or related products in need of protection against the effects of lightning while being used shall be 
fitted with a system for conducting the resultant electrical charge to earth."
62,2023/1230,Machinery Regulation,III,1,6,1,,"Machinery or related product maintenance
Adjustment and maintenance points shall be located outside danger zones. It shall be possible to carry out 
adjustment, maintenance, repair, cleaning and servicing operations while the machinery or related product is 
at a standstill.
If one or more of the above conditions cannot be satisfied for technical reasons, measures shall be taken to 
ensure that these operations can be carried out safely (see section 1.2.5).
In the case of automated machinery and, where necessary, other machinery or related products, a connecting 
device for mounting diagnostic fault-finding equipment shall be provided.
Automated machinery or related product components, which have to be changed frequently, shall be capable 
of being removed and replaced easily and safely. Access to the components shall enable these tasks to be 
carried out with the necessary technical means in accordance with a specified operating method."
63,2023/1230,Machinery Regulation,III,1,6,2,,"Access to operating positions and servicing points
Machinery or related products shall be designed and constructed in such a way as to allow access in safety to 
all areas where intervention is necessary during operation, adjustment, maintenance and cleaning of the 
machinery or related product.
In the case of machinery or related products into which persons shall enter for operation, adjustment, 
maintenance or cleaning, the machinery accesses shall be dimensioned and adapted for the use of rescue 
equipment in such a way that an emergency rescue of the persons is possible."
64,2023/1230,Machinery Regulation,III,1,6,3,,"Isolation of energy sources
Machinery or related products shall be fitted with means to isolate it from all energy sources. Such isolators 
shall be clearly identified. They shall be capable of being locked if reconnection could endanger persons. 
Isolators shall also be capable of being locked where an operator is unable, from any of the points to which 
he or she has access, to check that the energy is still cut off.
In the case of machinery or related products capable of being plugged into an electricity supply, removal of 
the plug is sufficient, if the operator can check from any of the points to which he or she has access that the 
plug remains removed.
After the energy is cut off, it shall be possible to dissipate normally any energy remaining or stored in the 
circuits of the machinery or related product without risk to persons.
As an exception to the requirement laid down in the previous paragraphs, certain circuits may remain 
connected to their energy sources in order, for example, to hold parts, to protect information, to light 
interiors, etc. In this case, special steps shall be taken to ensure operator safety."
65,2023/1230,Machinery Regulation,III,1,6,4,,"Operator intervention
The machinery or related product shall be so designed, constructed and equipped that the need for operator 
intervention is limited. If operator intervention cannot be avoided, it shall be possible to carry it out easily 
and safely."
66,2023/1230,Machinery Regulation,111,1,6,5,,"Cleaning of internal parts
The machinery or related product shall be designed and constructed in such a way that it is possible to clean 
internal parts, which have contained dangerous substances or mixtures without entering them; any necessary 
unblocking shall also be possible from the outside. If it is impossible to avoid entering the machinery or 
related product, it shall be designed and constructed in such a way as to allow cleaning to take place safely."
67,2006/42/EC,Machinery Directive,I,1,1,2,,1.1.2. Principles of safety integration
68,2006/42/EC,Machinery Directive,I,1,1,2,(a),"1.1.2.(a) Machinery must be designed and constructed so that it is fitted for its function, and can be operated, adjusted and maintained without putting persons at risk when these operations are carried out under the conditions foreseen but also taking into account any reasonably foreseeable misuse thereof. The aim of measures taken must be to eliminate any risk throughout the foreseeable lifetime of the machinery including the phases of transport, assembly, dismantling, disabling and scrapping."
69,2006/42/EC,Machinery Directive,I,1,1,2,(b),"1.1.2.(b) In selecting the most appropriate methods, the manufacturer or his authorised representative must apply the following principles, in the order given: — eliminate or reduce risks as far as possible (inherently safe machinery design and construction), — take the necessary protective measures in relation to risks that cannot be eliminated, — inform users of the residual risks due to any shortcomings of the protective measures adopted, indicate whether any particular training is required and specify any need to provide personal protective equipment."
70,2006/42/EC,Machinery Directive,I,1,1,2,(c),"1.1.2.(c) When designing and constructing machinery and when drafting the instructions, the manufacturer or his authorised representative must envisage not only the intended use of the machinery but also any reasonably foreseeable misuse thereof. The machinery must be designed and constructed in such a way as to prevent abnormal use if such use would engender a risk. Where appropriate, the instructions must draw the user's attention to ways — which experience has shown might occur — in which the machinery should not be used."
71,2006/42/EC,Machinery Directive,I,1,1,2,(d),1.1.2.(d) Machinery must be designed and constructed to take account of the constraints to which the operator is subject as a result of the necessary or foreseeable use of personal protective equipment.
72,2006/42/EC,Machinery Directive,I,1,1,2,(e),"1.1.2.(e) Machinery must be supplied with all the special equipment and accessories essential to enable it to be adjusted, maintained and used safely."
73,2006/42/EC,Machinery Directive,I,1,1,3,,"1.1.3. Materials and products The materials used to construct machinery or products used or created during its use must not endanger persons' safety or health. In particular, where fluids are used, machinery must be designed and constructed to prevent risks due to filling, use, recovery or draining."
74,2006/42/EC,Machinery Directive,I,1,1,4,,"1.1.4. Lighting 
Machinery must be supplied with integral lighting suitable for the operations concerned where the absence thereof is likely to cause a risk despite ambient lighting of normal intensity. Machinery must be designed and constructed so that there is no area of shadow likely to cause nuisance, that there is no irritating dazzle and that there are no dangerous stroboscopic effects on moving parts due to the lighting. Internal parts requiring frequent inspection and adjustment, and maintenance areas must be provided with appropriate lighting."
