ID,Document ID,Document Title,Annex,Section L1,Section L2,Section L3,Section L4,Essential Requirement
1,2014/30/EU,EMC Directive,,1,,,,"General requirements

Equipment shall be so designed and manufactured, having regard to the state of the art, as to ensure that:
(a) the electromagnetic disturbance generated does not exceed the level above which radio and telecommunications 
equipment or other equipment cannot operate as intended;
(b) it has a level of immunity to the electromagnetic disturbance to be expected in its intended use which allows it to 
operate without unacceptable degradation of its intended use."
2,2014/30/EU,EMC Directive,,2,,,,"Specific requirements for fixed installations
Installation and intended use of components
A fixed installation shall be installed applying good engineering practices and respecting the information on the intended use of its components, with a view to meeting the essential requirements set out in point 1."
3,2014/35/EU,Low Voltage Directive,I,1,,,,"General conditions
(a) the essential characteristics, the recognition and observance of which will ensure that electrical equipment will be used safely and in applications for which it was made, shall be marked on the electrical equipment, or, if this is not possible, on an accompanying document;
(b) the electrical equipment, together with its component parts, shall be made in such a way as to ensure that it can be safely and properly assembled and connected;
(c) the electrical equipment shall be so designed and manufactured as to ensure that protection against the hazards set out in points 2 and 3 is assured, providing that the equipment is used in applications for which it was made and is adequately maintained."
4,2014/35/EU,Low Voltage Directive,I,2,,,,"Protection against hazards arising from the electrical equipment
Measures of a technical nature shall be laid down in accordance with point 1, in order to ensure that:
(a) persons and domestic animals are adequately protected against the danger of physical injury or other harm which might be caused by direct or indirect contact;
(b) temperatures, arcs or radiation which would cause a danger, are not produced;
(c) persons, domestic animals and property are adequately protected against non-electrical dangers caused by the electrical equipment which are revealed by experience;
(d) the insulation is suitable for foreseeable conditions"
5,2014/35/EU,Low Voltage Directive,I,3,,,,"Protection against hazards which may be caused by external influences on the electrical equipment
Technical measures shall be laid down in accordance with point 1, in order to ensure that the electrical equipment:
(a) meets the expected mechanical requirements in such a way that persons, domestic animals and property are not endangered;
(b) is resistant to non-mechanical influences in expected environmental conditions, in such a way that persons, domestic animals and property are not endangered;
(c) does not endanger persons, domestic animals and property in foreseeable conditions of overload"
10,2023/1230,Machinery Regulation,III,1,1,1,,"Applicability
The obligations laid down by the essential health and safety requirements are applicable to partly completed machinery insofar as those requirements are relevant.
The relevant requirements in relation to partly completed machinery do not cover the requirements that can only be fulfilled at the time of the incorporation of the partly completed machinery. However, the principles of safety integration established in section 1.1.2 are applicable in all cases."
11,2023/1230,Machinery Regulation,III,1,1,2,,"Principles of safety integration
(a) Machinery or related products shall be designed and constructed so that they are fit for their function, 
and can be operated, adjusted and maintained without putting persons at risk when these operations are 
carried out under the conditions foreseen but also taking into account any reasonably foreseeable misuse 
thereof. The aim of protective measures shall be to eliminate any risk throughout the foreseeable lifetime 
of the machinery or related product including the phases of transport, assembly, dismantling, disabling 
and scrapping.
(b) In selecting the most appropriate methods, the manufacturer shall apply the following principles, in the 
order given:
(i) eliminate hazards or, if that is not possible, minimise risks (inherently safe machinery or related 
product design and construction);
(ii) take the necessary protective measures in relation to risks that cannot be eliminated;
(iii) inform users of the residual risks due to any shortcomings of the protective measures adopted, 
indicate whether any particular training is required and specify any need to provide personal 
protective equipment.
(c) When designing and constructing machinery or a related product and when drafting the instructions for 
use, the manufacturer shall envisage not only the intended use of the machinery or related product but 
also any reasonably foreseeable misuse thereof. The machinery or related product shall be designed and 
constructed in such a way as to prevent abnormal use if such use would engender a risk. Where 
appropriate, the instructions for use shall draw the user’s attention to ways – which experience has 
shown might occur – in which the machinery or related product should not be used.
(d) Machinery or related products shall be designed and constructed to take account of the constraints to 
which the operator is subject as a result of the necessary or foreseeable use of personal protective 
equipment.
(e) Machinery or related products shall be designed and constructed in such a way that it is possible for the 
user, where applicable, to test the safety functions. The machinery or related product shall be supplied 
with all the special equipment and accessories, and where appropriate, with the description of specific 
functional test procedures, essential to enable it to be tested, adjusted, maintained and used safely."
12,2023/1230,Machinery Regulation,III,1,1,3,,"Materials and products
The materials used to construct machinery or related products, or products used or created during its use, 
shall not endanger the health and safety of persons. In particular, where fluids are used, machinery or related 
products shall be designed and constructed to prevent risks due to filling, use, recovery or draining"
13,2023/1230,Machinery Regulation,III,1,1,4,,"Lighting
Machinery or related products shall be supplied with integral lighting suitable for the operations concerned, 
where the absence thereof is likely to cause a risk despite ambient lighting of normal intensity.
Machinery or related products shall be designed and constructed so that there is no area of shadow likely to 
cause nuisance, that there is no irritating dazzle and that there are no dangerous stroboscopic effects on 
moving parts due to the lighting.
Internal parts requiring frequent inspection and adjustment, and maintenance areas shall be provided with 
appropriate lighting."
14,2023/1230,Machinery Regulation,III,1,1,5,,"Design of machinery or a related product to facilitate its handling
Machinery or a related product or each component part thereof, shall:
(a) be capable of being handled and transported safely;
(b) be packaged or designed so that it can be stored safely and without damage.
During the transportation of the machinery or related product or its component parts, there shall be no 
possibility of sudden movements or of hazards due to instability as long as the machinery or related product 
or its component parts are handled in accordance with the instructions.
Where the weight, size or shape of machinery or a related product or its various component parts prevents it 
or them from being moved by hand, the machinery or related product or each component part shall:
(a) either be fitted with attachments for lifting gear; or
(b) be designed so that it can be fitted with such attachments; or
(c) be shaped in such a way that standard lifting gear can easily be attached.
Where machinery or a related product or one of its component parts is to be moved by hand, it shall either:
(a) be easily moveable; or
(b) be equipped for picking up and moving safely.
Special arrangements shall be made for the handling of tools and/or machinery or related product parts, 
which, even if lightweight, could be hazardous."
15,2023/1230,Machinery Regulation,III,1,1,6,,"Ergonomics
Under the intended conditions of use, the discomfort, fatigue and physical and psychological stress faced by 
the operator shall be eliminated or reduced to the minimum possible, taking into account at least, the 
following ergonomic principles:
(a) allowing for the variability of the operator’s physical dimensions, strength and stamina;
(b) avoiding the need for demanding work postures or movements and manual force exertions that exceed 
the operator’s capacity;
(c) providing enough space for movements of the parts of the operator’s body;
(d) avoiding a machine-determined work rate;
(e) avoiding monitoring that requires lengthy concentration;
(f) adapting the human-machine interface to the foreseeable characteristics of the operators, including with 
respect to machinery or a related product with intended fully or partially self-evolving behaviour or logic 
that is designed to operate with varying levels of autonomy;
(g) where relevant, adapting machinery or a related product with intended fully or partially self-evolving 
behaviour or logic that is designed to operate with varying levels of autonomy to respond to people 
adequately and appropriately (such as verbally through words and non-verbally through gestures, facial 
expressions or body movement) and to communicate its planned actions (such as what it is going to do 
and why) to operators in a comprehensible manner."
16,2023/1230,Machinery Regulation,III,1,1,7,,"Operating positions
The operating position shall be designed and constructed in such a way as to avoid any risk due to exhaust 
gases or lack of oxygen.
If the machinery or related product is intended to be used in a hazardous environment presenting risks to the 
health and safety of the operator or if the machinery or related product itself gives rise to a hazardous 
environment, adequate means shall be provided to ensure that the operator has good working conditions and 
is protected against any foreseeable hazards.
Where appropriate, the operating position shall be fitted with an adequate cabin designed, constructed or 
equipped to fulfil the above requirements. The exit shall allow rapid evacuation. Moreover, when applicable, 
an emergency exit shall be provided in a direction which is different from the usual exit."
17,2023/1230,Machinery Regulation,III,1,1,8,,"Seating
Where appropriate and where the working conditions so permit, work stations constituting an integral part 
of the machinery or related product shall be designed for the installation of seats.
If the operator is intended to sit during operation and the operating position is an integral part of the 
machinery or related product, the seat shall be provided with the machinery or related product.
The operator’s seat shall enable him or her to maintain a stable position. Furthermore, the seat and its 
distance from the control devices shall be capable of being adapted to the operator.
If the machinery or related product is subject to vibrations, the seat shall be designed and constructed in such a way as to reduce the vibrations transmitted to the operator to the lowest level that is reasonably possible. 
The seat mountings shall withstand all stresses to which they can be subjected. Where there is no floor 
beneath the feet of the operator, footrests covered with a slip-resistant material shall be provided."
18,2023/1230,Machinery Regulation,III,1,1,9,,"Protection against corruption
The machinery or related product shall be designed and constructed so that the connection to it of another 
device, via any feature of the connected device itself or via any remote device that communicates with the 
machinery or related product does not lead to a hazardous situation.
A hardware component transmitting signal or data, relevant for connection or access to software that is 
critical for the compliance of the machinery or related product with the relevant essential health and safety 
requirements shall be designed so that it is adequately protected against accidental or intentional corruption. 
The machinery or related product shall collect evidence of a legitimate or illegitimate intervention in that 
hardware component, when relevant for connection or access to software that is critical for the compliance of 
the machinery or related product.
Software and data that are critical for the compliance of the machinery or related product with the relevant 
essential health and safety requirements shall be identified as such and shall be adequately protected against accidental or intentional corruption.
The machinery or related product shall identify the software installed on it that is necessary for it to operate 
safely, and shall be able to provide that information at all times in an easily accessible form.
The machinery or related product shall collect evidence of a legitimate or illegitimate intervention in the 
software or a modification of the software installed on the machinery or related product or its configuration."
19,2023/1230,Machinery Regulation,III,1,2,1,,"Safety and reliability of control systems
Control systems shall be designed and constructed in such a way as to prevent hazardous situations from 
arising.
Control systems shall be designed and constructed in such a way that:
(a) they can withstand, where appropriate to the circumstances and the risks, the intended operating stresses and intended and unintended external influences, including reasonably foreseeable malicious attempts from third parties leading to a hazardous situation;
(b) a fault in the hardware or the logic of the control system shall not lead to hazardous situations;
(c) errors in the control system logic shall not lead to hazardous situations;
(d) the limits of the safety functions are to be established as part of the risk assessment performed by the 
manufacturer and no modifications are allowed to the settings or rules generated by the machinery or 
related product or by operators, including during the machinery or related product learning phase, where 
such modifications could lead to hazardous situations;
(e) reasonably foreseeable human errors during operation shall not lead to hazardous situations;
(f) the tracing log of the data generated in relation to an intervention and of the versions of safety software 
uploaded after the machinery or related product has been placed on the market or put into service is 
enabled for five years after such upload, exclusively to demonstrate the conformity of the machinery or 
related product with this Annex further to a reasoned request from a competent national authority.
Control systems of machinery or related products with fully or partially self-evolving behaviour or logic that 
are designed to operate with varying levels of autonomy shall be designed and constructed in such a way that:
(a) they shall not cause the machinery or related product to perform actions beyond its defined task and 
movement space;
(b) recording of data on the safety related decision-making process for software based safety systems ensuring 
safety function including safety components, after the machinery or related product has been placed on 
the market or put into service, is enabled and that such data is retained for one year after its collection, 
exclusively to demonstrate the conformity of the machinery or related product with this Annex further to 
a reasoned request from a competent national authority;
(c) it shall be possible at all times to correct the machinery or related product in order to maintain its 
inherent safety.
Particular attention shall be given to the following points:
(a) the machinery or related product shall not start unexpectedly;
(b) the parameters of the machinery or related product shall not change in an uncontrolled way, where such 
change could lead to hazardous situations;
(c) modifications to the settings or rules, generated by the machinery or related product or by operators, 
including during the machinery or related product learning phase, shall be prevented, where such 
modifications could lead to hazardous situations;
(d) the machinery or related product shall not be prevented from stopping if the stop command has already 
been given;
(e) no moving part of the machinery or related product or piece held by the machinery or related product 
shall fall or be ejected;
(f) automatic or manual stopping of the moving parts, whatever they may be, shall be unimpeded;
(g) the protective devices shall remain fully effective or give a stop command;
(h) the safety-related parts of the control system shall apply in a coherent way to the whole of an assembly of 
machinery or related products or partly completed machinery, or a combination thereof.
For wireless control, a failure of the communication or connection or a faulty connection shall not lead to a 
hazardous situation."
20,2023/1230,Machinery Regulation,III,1,2,2,,"Control devices
Control devices shall be:
(a) clearly visible and identifiable, using pictograms where appropriate;
(b) positioned in such a way as to be safely operated without hesitation or loss of time and without 
ambiguity;
(c) designed in such a way that the movement of the control device is consistent with its effect;
(d) located outside the danger zones, except where necessary for certain control devices such as an 
emergency stop or a teach pendant;
(e) positioned in such a way that their operation cannot cause additional risk;
(f) designed or protected in such a way that the desired effect, where a hazard is involved, can only be 
achieved by a deliberate action;
(g) made in such a way as to withstand foreseeable forces, paying particular attention to emergency stop 
devices liable to be subjected to considerable forces.
Where a control device is designed and constructed to perform several different actions, namely, where there 
is no one-to-one correspondence, the action to be performed shall be clearly displayed and subject to 
confirmation, where necessary.
Control devices shall be so arranged that their layout, travel and resistance to operation are compatible with 
the action to be performed, taking account of ergonomic principles.
Machinery or related products shall be fitted with indicators as required for safe operation. The operator shall 
be able to read them from the control position.
From each control position, the operator shall be able to ensure that no one is in the danger zones, or the 
control system shall be designed and constructed in such a way that starting is prevented while someone is in 
the danger zone.
If neither of these possibilities is applicable, before the machinery or related product starts, an acoustic and/or 
visual warning signal shall be given. The exposed persons shall have time to leave the danger zone or prevent 
the machinery starting up.
If necessary, means shall be provided to ensure that the machinery or related product can be controlled only 
from control positions located in one or more predetermined zones or locations.
Where there is more than one control position, the control system shall be designed in such a way that the 
use of one of them precludes the use of the others, except for stop controls and emergency stops.
When the machinery or related product has two or more operating positions, each position shall be provided 
with all the required control devices without the operators hindering or putting each other into a hazardous 
situation."
21,2023/1230,Machinery Regulation,III,1,2,3,,"Starting
It shall be possible to start the machinery or related product only by voluntary actuation of a control device 
provided for the purpose.
The same requirement applies:
(a) when restarting the machinery or related product after a stoppage, whatever the cause;
(b) when effecting a significant change in the operating conditions.
However, the restarting of the machinery or related product or a change in operating conditions may be 
effected by voluntary actuation of a device other than the control device provided for the purpose, on 
condition that this does not lead to a hazardous situation.
For the machinery or related product functioning in automatic mode, the starting of the machinery or related 
product, restarting after a stoppage, or a change in operating conditions may be possible without intervention, provided this does not lead to a hazardous situation.
Where the machinery or related product has several starting control devices and the operators can therefore 
put each other in danger, additional devices shall be fitted to rule out such risks. If safety requires that starting 
and/or stopping shall be performed in a specific sequence, there shall be devices that ensure that these 
operations are performed in the correct order."
22,2023/1230,Machinery Regulation,III,1,2,4,1,"N o r m a l s t o p
The machinery or related product shall be fitted with a control device whereby the machinery can be brought 
safely to a complete stop.
Each workstation shall be fitted with a control device to stop some or all of the functions of the machinery 
or related product, depending on the existing hazards, so that the machinery or related product is rendered 
safe.
The machinery or related product’s stop control shall have priority over the start controls.
Once the machinery or related product or its hazardous functions have stopped, the energy supply to the 
actuators concerned shall be cut off."
23,2023/1230,Machinery Regulation,III,1,2,4,2,"O p e r a t i o n a l s t o p
Where, for operational reasons, a stop control that does not cut off the energy supply to the actuators is 
required, the stop condition shall be monitored and maintained."
24,2023/1230,Machinery Regulation,III,1,2,4,3,"E m e r g e n c y s t o p
The machinery or related product shall be fitted with one or more emergency stop devices to enable actual or 
impending danger to be averted.
The following exceptions apply:
(a) the machinery or related product in which an emergency stop device would not lessen the risk, either 
because it would not reduce the stopping time or because it would not enable the special measures 
required to deal with the risk to be taken;
(b) portable hand-held or hand-guided machinery or related products.
The device shall:
(a) have clearly identifiable, clearly visible and quickly accessible control devices;
(b) stop the hazardous process as quickly as possible, without creating additional risks;
(c) where necessary, trigger or permit the triggering of certain safeguard movements.
Once active operation of the emergency stop device has ceased following a stop command, that command 
shall be sustained by engagement of the emergency stop device until that engagement is specifically overridden; it shall not be possible to engage the device without triggering a stop command; it shall be possible to 
disengage the device only by an appropriate operation, and disengaging the device shall not restart the 
machinery or related product but only permit restarting.
The emergency stop function shall be available and operational at all times, regardless of the operating mode.
Emergency stop devices shall be a backup to other safeguarding measures and not a substitute for them."
25,2023/1230,Machinery Regulation,III,1,2,4,4,"A s s e m b l y o f m a c h i n e r y o r r e l a t e d p r o d u c t s
In the case of machinery or a related product or parts of machinery or a related product designed to work 
together, the machinery or a related product shall be designed and constructed in such a way that the stop 
controls, including the emergency stop devices, can stop not only the machinery or related product itself but 
also all related equipment, if its continued operation may be dangerous."
26,2023/1230,Machinery Regulation,III,1,2,4,5,"Selection of control or operating modes
The control or operating mode selected shall override all other control or operating modes, with the 
exception of the emergency stop.
If the machinery or related product has been designed and constructed to allow its use in several control or 
operating modes requiring different protective measures and/or work procedures, it shall be fitted with a 
mode selector, which can be locked in each position. Each position of the selector shall be clearly identifiable 
and shall correspond to a single operating or control mode.
The selector may be replaced by another selection method, which restricts the use of certain functions of the 
machinery or related product to certain categories of operator.
If, for certain operations, the machinery or related product shall be able to operate with a guard displaced or 
removed and/or a protective device disabled, the control or operating mode selector shall simultaneously:
(a) disable all other control or operating modes;
(b) permit operation of hazardous functions only by control devices requiring sustained action;
(c) permit the operation of hazardous functions only in reduced risk conditions while preventing hazards 
from linked sequences;
(d) prevent any operation of hazardous functions by voluntary or involuntary action on the machinery’s or 
related product’s sensors.
If these four conditions cannot be fulfilled simultaneously, the control or operating mode selector shall 
activate other protective measures designed and constructed to ensure a safe intervention zone.
In addition, the operator shall be able to control the operation of the parts he or she is working on from the 
adjustment point"
